{
  "attemptLimit": 10,
  "channel": "rc",
  "expected": {
    "apiDigest": "sha256:57831601643e599db4382fb0b53103b519f768a372edeff1f42f847fc55129f8",
    "assets": {
      "checksums.txt": {
        "sha256": "sha256:b9823bd27aad35993904853f2baab5265b2d497fd9e526a64154b94b0044368c",
        "size": 269
      },
      "deployment-contract.json": {
        "sha256": "sha256:904c2625020c255cb31429e3a2a06c4492af4b2b2ae275bfd463c5e34600b969",
        "size": 42128
      },
      "installer-materials.tar": {
        "sha256": "sha256:60059e9b001d889658884ce40d4f09212fbb1edd17b721703f8428a5c75a2d42",
        "size": 133079040
      },
      "release-manifest.json": {
        "sha256": "sha256:d31e5d4373856f435bb6d8b3e4e9ca0b96095665727b76344fc97a9edb01fb3d",
        "size": 3305
      }
    },
    "transportAssets": {
      "animemo-v2.0.0-rc.1-portable.tar": {
        "role": "PORTABLE_RELEASE_BUNDLE",
        "sha256": "sha256:961ef940f73a36fe6550bccfe7b6af517bedc509d04b46113c10abc5ea1f63b5",
        "size": 409251840
      }
    },
    "webDigest": "sha256:55334e0fdd328180a0392bcb906a3c8a9c85fff17e7c072821aebe0ad6d3da16"
  },
  "finalState": "ACTIVE",
  "ledgerIdentity": "sha256:fa6e3c3bb13cd9e78f753d168539ca4a9474a48fd470f9a1f058bf84b650c5ab",
  "operationId": "sha256:627690999ef42730f1034eff3f29b084e34bc8d24b0329043b683d48696f98c0",
  "planDigest": "sha256:47efc030ae1185ec474d4764c39ad9d39dbca0bdf0d6d9bff3662ef86d4a8946",
  "planIdentity": "sha256:d25ee55dd8937ce0eb2340b0cd4eda0e8c8b6d41cb19f6cc3643aa1ea3ece886",
  "planSchema": "animemo.release-publication-plan/v2",
  "previousLedgerIdentity": "sha256:ee6863b1a30212680e66888dd6eb4c01aa73b4451d7eca3458cb3266ee047888",
  "recoveryStatus": "REMOTE_ABSENT_EXACT_CONTINUE",
  "repository": "yanyuhanyue/AniMemo",
  "revision": 30,
  "schemaVersion": 1,
  "source": {
    "sha": "715e997e1b8ef552376148fee62b08d7c0c35364",
    "tree": "04a4848b914a3b212bd49440006b4c8654740a9f"
  },
  "steps": [
    {
      "attempts": [
        {
          "committed": true,
          "intentIdentity": "sha256:86800e5480f7717de9b77311dc53bbb6ef8afd15e8f891f5ef495856a2b1527b",
          "number": 1,
          "prestate": {
            "classification": "ABSENT",
            "diagnosticCode": null,
            "identity": null
          },
          "readback": {
            "classification": "SAME",
            "diagnosticCode": null,
            "identity": "sha256:57831601643e599db4382fb0b53103b519f768a372edeff1f42f847fc55129f8"
          },
          "requestStarted": true,
          "response": {
            "classification": "ACKNOWLEDGED",
            "diagnosticCode": null
          }
        }
      ],
      "committed": true,
      "expectedIdentity": "sha256:57831601643e599db4382fb0b53103b519f768a372edeff1f42f847fc55129f8",
      "kind": "REGISTRY_PUSH",
      "name": "registry-api-version",
      "preflight": {
        "classification": "SAME",
        "diagnosticCode": null,
        "identity": "sha256:57831601643e599db4382fb0b53103b519f768a372edeff1f42f847fc55129f8"
      },
      "remoteKey": "ghcr.io/yanyuhanyue/animemo-api:v2.0.0-rc.1",
      "state": "COMMITTED"
    },
    {
      "attempts": [
        {
          "committed": true,
          "intentIdentity": "sha256:e9331df5033ce0ea77270893f27a9307d9c7c0a92779ce2ab5ae6902085ecf45",
          "number": 1,
          "prestate": {
            "classification": "ABSENT",
            "diagnosticCode": null,
            "identity": null
          },
          "readback": {
            "classification": "SAME",
            "diagnosticCode": null,
            "identity": "sha256:57831601643e599db4382fb0b53103b519f768a372edeff1f42f847fc55129f8"
          },
          "requestStarted": true,
          "response": {
            "classification": "ACKNOWLEDGED",
            "diagnosticCode": null
          }
        }
      ],
      "committed": true,
      "expectedIdentity": "sha256:57831601643e599db4382fb0b53103b519f768a372edeff1f42f847fc55129f8",
      "kind": "REGISTRY_PUSH",
      "name": "registry-api-source",
      "preflight": {
        "classification": "SAME",
        "diagnosticCode": null,
        "identity": "sha256:57831601643e599db4382fb0b53103b519f768a372edeff1f42f847fc55129f8"
      },
      "remoteKey": "ghcr.io/yanyuhanyue/animemo-api:sha-715e997e1b8ef552376148fee62b08d7c0c35364",
      "state": "COMMITTED"
    },
    {
      "attempts": [
        {
          "committed": true,
          "intentIdentity": "sha256:601d43098e056aed22ef5b90334eff5aef4d76968292bc70ba8e5bc0f4bff27a",
          "number": 1,
          "prestate": {
            "classification": "ABSENT",
            "diagnosticCode": null,
            "identity": null
          },
          "readback": {
            "classification": "SAME",
            "diagnosticCode": null,
            "identity": "sha256:55334e0fdd328180a0392bcb906a3c8a9c85fff17e7c072821aebe0ad6d3da16"
          },
          "requestStarted": true,
          "response": {
            "classification": "ACKNOWLEDGED",
            "diagnosticCode": null
          }
        }
      ],
      "committed": true,
      "expectedIdentity": "sha256:55334e0fdd328180a0392bcb906a3c8a9c85fff17e7c072821aebe0ad6d3da16",
      "kind": "REGISTRY_PUSH",
      "name": "registry-web-version",
      "preflight": {
        "classification": "SAME",
        "diagnosticCode": null,
        "identity": "sha256:55334e0fdd328180a0392bcb906a3c8a9c85fff17e7c072821aebe0ad6d3da16"
      },
      "remoteKey": "ghcr.io/yanyuhanyue/animemo-web:v2.0.0-rc.1",
      "state": "COMMITTED"
    },
    {
      "attempts": [
        {
          "committed": true,
          "intentIdentity": "sha256:4956a816e1b5c14c80790196f7d426f1947817d4fd2d708ed40cc7de8f7cb96b",
          "number": 1,
          "prestate": {
            "classification": "ABSENT",
            "diagnosticCode": null,
            "identity": null
          },
          "readback": {
            "classification": "SAME",
            "diagnosticCode": null,
            "identity": "sha256:55334e0fdd328180a0392bcb906a3c8a9c85fff17e7c072821aebe0ad6d3da16"
          },
          "requestStarted": true,
          "response": {
            "classification": "ACKNOWLEDGED",
            "diagnosticCode": null
          }
        }
      ],
      "committed": true,
      "expectedIdentity": "sha256:55334e0fdd328180a0392bcb906a3c8a9c85fff17e7c072821aebe0ad6d3da16",
      "kind": "REGISTRY_PUSH",
      "name": "registry-web-source",
      "preflight": {
        "classification": "SAME",
        "diagnosticCode": null,
        "identity": "sha256:55334e0fdd328180a0392bcb906a3c8a9c85fff17e7c072821aebe0ad6d3da16"
      },
      "remoteKey": "ghcr.io/yanyuhanyue/animemo-web:sha-715e997e1b8ef552376148fee62b08d7c0c35364",
      "state": "COMMITTED"
    },
    {
      "attempts": [
        {
          "committed": true,
          "intentIdentity": "sha256:5441dead3e80d0a89890946a392e8b5f38a5a0cfb9786845c56bf0a12937b277",
          "number": 1,
          "prestate": {
            "classification": "ABSENT",
            "diagnosticCode": null,
            "identity": null
          },
          "readback": {
            "classification": "SAME",
            "diagnosticCode": null,
            "identity": "sha256:8e502c3865ecc8b177a9c4d630b06d1d34026a24d08f8ea591969a089977b74d"
          },
          "requestStarted": true,
          "response": {
            "classification": "ACKNOWLEDGED",
            "diagnosticCode": null
          }
        }
      ],
      "committed": true,
      "expectedIdentity": "sha256:8e502c3865ecc8b177a9c4d630b06d1d34026a24d08f8ea591969a089977b74d",
      "kind": "ATTESTATION",
      "name": "attestation-api",
      "preflight": {
        "classification": "SAME",
        "diagnosticCode": null,
        "identity": "sha256:8e502c3865ecc8b177a9c4d630b06d1d34026a24d08f8ea591969a089977b74d"
      },
      "remoteKey": "oci://ghcr.io/yanyuhanyue/animemo-api@sha256:57831601643e599db4382fb0b53103b519f768a372edeff1f42f847fc55129f8",
      "state": "COMMITTED"
    },
    {
      "attempts": [
        {
          "committed": true,
          "intentIdentity": "sha256:ffee3e6b3607d5ee32e882f868569742b3980e015eb287622542d17ee1b14d44",
          "number": 1,
          "prestate": {
            "classification": "ABSENT",
            "diagnosticCode": null,
            "identity": null
          },
          "readback": {
            "classification": "SAME",
            "diagnosticCode": null,
            "identity": "sha256:cdda3489d2ba2557af3dd6e34367a6f6b954d8d42ed56ea3a91ca21f783538b1"
          },
          "requestStarted": true,
          "response": {
            "classification": "ACKNOWLEDGED",
            "diagnosticCode": null
          }
        }
      ],
      "committed": true,
      "expectedIdentity": "sha256:cdda3489d2ba2557af3dd6e34367a6f6b954d8d42ed56ea3a91ca21f783538b1",
      "kind": "ATTESTATION",
      "name": "attestation-web",
      "preflight": {
        "classification": "SAME",
        "diagnosticCode": null,
        "identity": "sha256:cdda3489d2ba2557af3dd6e34367a6f6b954d8d42ed56ea3a91ca21f783538b1"
      },
      "remoteKey": "oci://ghcr.io/yanyuhanyue/animemo-web@sha256:55334e0fdd328180a0392bcb906a3c8a9c85fff17e7c072821aebe0ad6d3da16",
      "state": "COMMITTED"
    },
    {
      "attempts": [
        {
          "committed": true,
          "intentIdentity": "sha256:f32d451e1e26fe2606e65f1db4daed25ba75d3daea21242f290216ecbdef904e",
          "number": 1,
          "prestate": {
            "classification": "ABSENT",
            "diagnosticCode": null,
            "identity": null
          },
          "readback": {
            "classification": "SAME",
            "diagnosticCode": null,
            "identity": "sha256:c08dd2f051088dd14c822cb322dd3870cd799631518b4c1cbc696379c7a773a0"
          },
          "requestStarted": true,
          "response": {
            "classification": "ACKNOWLEDGED",